10:39:31.047552 IP 10.0.2.15.56322 > 93.243.107.34.bc.googleusercontent.com.https: Flags [P.], seq 303779469:303779508, ack 2348608902, win 63340, length 39
E..O.T@.@..}
..."k.]......N.....P..l"......."P.2.....{....h.P.k1T...M....N.V9..
10:39:31.048121 IP 93.243.107.34.bc.googleusercontent.com.https > 10.0.2.15.56322: Flags [.], ack 39, win 65535, length 0
E..(....@..A"k.]
.............N.P.............
10:39:31.300640 IP 93.243.107.34.bc.googleusercontent.com.https > 10.0.2.15.56322: Flags [P.], seq 1:40, ack 39, win 65535, length 39
E..O....@..."k.]
.............N.P...7.......".Ixi	...;...6.. ..d.(>0..l...q.l..
10:39:31.300688 IP 10.0.2.15.56322 > 93.243.107.34.bc.googleusercontent.com.https: Flags [.], ack 40, win 63301, length 0
E..(.U@.@...
..."k.]......N.....P..E!...
10:39:33.157097 IP 10.0.2.15.57554 > 209.100.149.34.bc.googleusercontent.com.https: Flags [P.], seq 3411859642:3411859688, ack 2348931688, win 63514, length 46
E..V.D@.@...
...".d......\.....hP...........)........`...dU....Wk.1..a...h..o.........
10:39:33.158016 IP 209.100.149.34.bc.googleusercontent.com.https > 10.0.2.15.57554: Flags [.], ack 46, win 65535, length 0
E..(....@.Z.".d.
..........h.\..P.../"........
10:39:33.355742 IP 209.100.149.34.bc.googleusercontent.com.https > 10.0.2.15.57554: Flags [P.], seq 1:47, ack 46, win 65535, length 46
E..V....@.Zs".d.
..........h.\..P...........)...........E..d..x......Mb~..u.r...'..V.a
10:39:33.355764 IP 10.0.2.15.57554 > 209.100.149.34.bc.googleusercontent.com.https: Flags [.], ack 47, win 63468, length 0
E..(.E@.@...
...".d......\......P.......
10:40:23.172422 IP 10.0.2.15.56322 > 93.243.107.34.bc.googleusercontent.com.https: Flags [P.], seq 39:78, ack 40, win 63301, length 39
E..O.V@.@..{
..."k.]......N.....P..E".......".....j.....X.t....5-.{.b~........f
10:40:23.173207 IP 93.243.107.34.bc.googleusercontent.com.https > 10.0.2.15.56322: Flags [.], ack 78, win 65535, length 0
E..(....@..="k.]
.............N.P.............
10:40:23.173584 IP 10.0.2.15.56322 > 93.243.107.34.bc.googleusercontent.com.https: Flags [P.], seq 78:102, ack 40, win 63301, length 24
E..@.W@.@...
..."k.]......N.....P..E"
........	..-t(..$.(!......
10:40:23.173642 IP 10.0.2.15.56322 > 93.243.107.34.bc.googleusercontent.com.https: Flags [F.], seq 102, ack 40, win 63301, length 0
E..(.X@.@...
..."k.]......N.....P..E!...
10:40:23.174239 IP 93.243.107.34.bc.googleusercontent.com.https > 10.0.2.15.56322: Flags [.], ack 102, win 65535, length 0
E..(....@..<"k.]
.............N.P.............
10:40:23.174557 IP 93.243.107.34.bc.googleusercontent.com.https > 10.0.2.15.56322: Flags [.], ack 103, win 65535, length 0
E..(....@..;"k.]
.............N.P.............
10:40:23.340584 IP 93.243.107.34.bc.googleusercontent.com.https > 10.0.2.15.56322: Flags [F.], seq 40, ack 103, win 65535, length 0
E..(....@..:"k.]
.............N.P.............
10:40:23.340605 IP 10.0.2.15.56322 > 93.243.107.34.bc.googleusercontent.com.https: Flags [.], ack 41, win 63301, length 0
E..(..@.@...
..."k.]......N.....P..E.>..
10:40:23.350216 IP6 fe80::2 > ip6-allnodes: ICMP6, router advertisement, length 56
`....8:.....................................@.............RV......@...Q...8@....................
10:40:23.363224 IP6 fe80::a915:3c86:e0fb:6e05 > ff02::16: HBH ICMP6, multicast listener report v2, 2 group record(s), length 48
`....8............<...n.................:........."......................
.(..................n.
10:40:23.790941 IP6 fe80::a915:3c86:e0fb:6e05 > ff02::16: HBH ICMP6, multicast listener report v2, 2 group record(s), length 48
`....8............<...n.................:........."......................
.(..................n.
10:40:25.174193 IP 10.0.2.15.57554 > 209.100.149.34.bc.googleusercontent.com.https: Flags [P.], seq 46:92, ack 47, win 63468, length 46
E..V.F@.@...
...".d......\......P...........).........._n..V.}...
.....wj......5.=...'
10:40:25.174982 IP 209.100.149.34.bc.googleusercontent.com.https > 10.0.2.15.57554: Flags [.], ack 92, win 65535, length 0
E..(....@.Z.".d.
............\..P.............
10:40:25.175308 IP 10.0.2.15.57554 > 209.100.149.34.bc.googleusercontent.com.https: Flags [P.], seq 92:123, ack 47, win 63468, length 31
E..G.G@.@...
...".d......\......P.....................x..L../.Z.U...=.!
10:40:25.175381 IP 10.0.2.15.57554 > 209.100.149.34.bc.googleusercontent.com.https: Flags [F.], seq 123, ack 47, win 63468, length 0
E..(.H@.@...
...".d......\.5....P.......
10:40:25.176021 IP 209.100.149.34.bc.googleusercontent.com.https > 10.0.2.15.57554: Flags [.], ack 123, win 65535, length 0
E..(....@.Z.".d.
............\.5P.............
10:40:25.176023 IP 209.100.149.34.bc.googleusercontent.com.https > 10.0.2.15.57554: Flags [.], ack 124, win 65535, length 0
E..(....@.Z.".d.
............\.6P.............
10:40:25.359140 IP 209.100.149.34.bc.googleusercontent.com.https > 10.0.2.15.57554: Flags [F.], seq 47, ack 124, win 65535, length 0
E..(....@.Z.".d.
............\.6P.............
10:40:25.359177 IP 10.0.2.15.57554 > 209.100.149.34.bc.googleusercontent.com.https: Flags [.], ack 48, win 63468, length 0
E..(..@.@..[
...".d......\.6....P...6...
